职位,薪资,工作时间,公司,工作地点,所在城市
高级前端开发工程师,15k-25k,5-10年,雷神科技有限公司,软件新城二期C11栋14楼,武汉
web前端实习生,7k-14k,不限,北京金科汇智科技有限公司,南三环西路16号院2号楼2009,北京
前端开发工程师,10k-15k,在校/应届,上海亘岩网络科技有限公司,联航路1188弄浦江智谷33号楼,上海
前端开发工程师,9k-15k,在校/应届,宁波邻家网络科技有限公司,翠柏路89号宁波工程学院A座13楼,宁波
前端开发工程师,7k-10k,在校/应届,广州数鹏通科技有限公司,五山能源路2号节能与环保大楼,广州
前端开发工程师,10k-18k,在校/应届,北京柏睿数据技术股份有限公司,武汉光谷保利国际中心,武汉
前端开发工程师,12k-16k,不限,上海微创软件股份有限公司,武汉经济技术开发区南太子湖创新谷启迪协信科创园7号楼B栋,武汉
前端开发工程师,15k-30k,在校/应届,杭州硕磐智能科技有限公司,钱江电气大厦17楼,杭州
前端开发工程师,10k-15k,在校/应届,上海亘岩网络科技有限公司,联航路1188弄浦江智谷33号楼,上海
前端开发工程师,10k-18k,在校/应届,北京柏睿数据技术股份有限公司,望京东园七区保利国际广场T1,北京
前端开发工程师,12k-24k,在校/应届,顺丰科技有限公司,深投控创智天地大厦（科技南一路与高新二道交叉口东北150米）,深圳
前端工程师,6k-12k,在校/应届,千瓦科技（上海）有限公司,亮秀路112号,上海
前端开发工程师,14k-28k,不限,北京外企德科人力资源服务上海有限公司,华为研究,武汉
前端开发工程师,15k-30k,不限,北京外企德科人力资源服务上海有限公司,坂田华为,深圳
前端开发工程师,15k-30k,在校/应届,欧科互动网络科技（北京）有限公司,创业路8号群英科技园3号楼4楼/5楼,北京
前端架构师,25k-45k,5-10年,成都薯片科技有限公司,顶呱呱政企服务中心,成都
前端开发工程师,15k-20k,5-10年,恩士迅信息科技（成都）有限公司,天府软件园B区,成都
前端开发工程师,14k-20k,5-10年,中电金信软件有限公司,OCG,成都
前端开发工程师,15k-18k,3-5年,中电金信软件有限公司,太古汇,广州
前端开发工程师,10k-15k,3-5年,成都富宏科技有限公司,大源国际A3栋903,成都
前端开发工程师,15k-24k,3-5年,活跃网络（成都）有限公司,IFS国际金融中心1号办公楼49楼,成都
前端开发工程师,13k-20k,3-5年,京北方信息技术股份有限公司,市桥,广州
前端开发工程师,16k-20k,3-5年,深圳市法本信息技术股份有限公司,华泰创业园,杭州
前端开发工程师,15k-30k,5-10年,恩士迅信息科技（成都）有限公司,黄埔区中新智慧园A2栋5楼,广州
前端开发工程师,18k-25k,5-10年,中电金信软件有限公司,太古汇,广州
前端开发工程师,10k-16k,3-5年,广东瀚阳轨道信息科技有限公司,神州路18号润慧科技园E栋2楼,广州
前端开发工程师,8k-15k,1-3年,云仓优选科技（深圳）有限公司,东华集团,深圳
前端开发工程师,12k-24k,5-10年,上海美嘉林软件科技股份有限公司,桂平路418号512室,上海
H5前端开发工程师,10k-14k,1-3年,深圳市名通科技股份有限公司,深圳市南山区科技园科发路8号金融基地2栋10A,深圳
前端开发工程师,11k-13k,1-3年,广州市数商云网络科技有限公司,天银商贸厦14楼,广州
前端工程师-氚云,25k-50k,3-5年,深圳奥哲网络科技有限公司,深圳南山区科兴科学园B1栋18层,深圳
web前端开发工程师,10k-15k,1-3年,中科软科技股份有限公司,雍和宫壹中心,北京
前端开发工程师,15k-30k,3-5年,美的集团股份有限公司,花城大道武汉软件新城,武汉
前端开发工程师,20k-40k,3-5年,探探科技（北京）有限公司,东大桥路光华路SOHO二期C座1601,北京
前端开发工程师,20k-35k,5-10年,北京乐我无限科技有限责任公司,朝阳北路甲27号菁英梦谷A3栋,北京
前端,14k-18k,3-5年,深圳市法本信息技术股份有限公司,福田街道金田路2026号能源大厦北塔13楼,深圳
web前端工程师,20k-40k,5-10年,上海国际主题乐园有限公司,申迪北路750号,上海
web前端开发工程师,12k-18k,3-5年,京北方信息技术股份有限公司,广州市天河区车陂路113号东宏国际大厦1307房,广州
乌鸫科技-前端开发工程师,10k-18k,1-3年,杭州乌鸫科技有限公司,阿里巴巴西溪园区A区,杭州
前端开发工程师-宝安区石岩,15k-17k,5-10年,杭州博彦信息技术有限公司,创维创新谷2号楼B座,深圳
前端开发-统招本科,12k-14k,1-3年,杭州博彦信息技术有限公司,螺旋大道 51 号,广州
web前端开发工程师,15k-28k,3-5年,好喔科技（北京）有限公司,万利,北京
前端工程师-react,15k-18k,1-3年,深圳市法本信息技术股份有限公司,黄龙时代广场,杭州
web前端开发工程师,15k-28k,5-10年,好喔科技（北京）有限公司,西二旗上地信息路9号北京发那科机电有限公司,北京
前端工程师,8k-12k,1-3年,北京视野智慧数字科技有限公司,益州大道北段777号中航国际交流中心B906A室,成都
前端工程师,8k-12k,1-3年,北京视野智慧数字科技有限公司,益州大道北段777号中航国际交流中心B906A室,成都
前端开发工程师,14k-28k,3-5年,深圳市汇合发展有限公司,科兴科学园,深圳
前端开发工程师,15k-20k,3-5年,深圳市睿服科技有限公司,荣超大厦,深圳
前端开发工程师,3k-6k,3-5年,北京研语教育科技有限公司,广源闸5号7层,北京
前端开发工程师,11k-17k,3-5年,京北方信息技术股份有限公司,禾盛京广中心,西安
前端开发工程师,12k-20k,1-3年,广州优聚大鱼科技有限公司,天河软件园科韵园区建中路59号（柏朗奴商务大厦）8楼,广州
前端开发工程师,14k-17k,5-10年,杭州博彦信息技术有限公司,深圳宝安区酷开网络(平面显示大楼店)10楼,深圳
前端开发工程师,14k-28k,3-5年,深圳市汇合发展有限公司,天府四街招商银行后台服务中心,成都
web前端工程师,20k-23k,5-10年,天津薪睿网络技术有限公司,联想总部东区,北京
前端开发工程师,11k-15k,1-3年,广州数鹏通科技有限公司,五山能源路2号节能与环保大楼,广州
前端开发工程师,15k-30k,3-5年,深圳市汇合发展有限公司,科达投资大厦,杭州
前端工程师,15k-30k,5-10年,上海品腾信息技术有限公司,杨浦区,上海
前端开发工程师,25k-50k,5-10年,润欣商业投资（深圳）有限公司,华润置地大厦B座,深圳
前端开发工程师,13k-16k,3-5年,中电金信软件有限公司,壬丰,广州
前端开发工程师,20k-40k,1-3年,南京伯索网络科技有限公司,晨光1865科技&middot;创意产业园,南京
中级前端开发工程师,12k-19k,3-5年,北京翼辉信息技术有限公司,中铁,西安
前端开发工程师,14k-20k,5-10年,中软国际科技服务有限公司,置汇旭辉广场,上海
前端开发工程师,15k-25k,1-3年,融捷教育科技有限公司,清华科技园,北京
前端开发工程师,15k-18k,3-5年,上海微创软件股份有限公司,北京市海淀区中关村软件园24号楼,北京
Web前端开发工程师（Vue）,18k-30k,3-5年,北京乐我无限科技有限责任公司,朝阳北路甲27号菁英梦谷常营A3栋,北京
前端开发工程师,15k-25k,3-5年,深圳市汇合发展有限公司,科兴科学园,深圳
前端工程师,13k-26k,3-5年,深圳市德科信息技术有限公司,华润前海中心B座,深圳
前端开发工程师,12k-18k,1-3年,杭州大名软件有限公司,华星时代广场,杭州
前端工程师,8k-15k,1-3年,珠海盈米基金销售有限公司,凤凰天阶苑5栋5012,长沙
前端工程师,9k-15k,1-3年,广州群接龙网络科技有限公司,新港中路397号TIT创意园 创意西街43号（纺园公寓对面）,广州
前端研发工程师,25k-33k,不限,兴业普惠科技（福建）有限公司,祥科路,上海
前端开发工程师,18k-25k,5-10年,北京铸云网络科技有限公司,金融街万科丰科中心10F,北京
前端开发工程师,15k-25k,1-3年,壁虎软件科技（深圳）有限公司,前海卓越,深圳
前端开发工程师,7k-10k,1-3年,广州趣米网络科技有限公司,天河慧通产业广场B区B4栋2楼,广州
前端工程师,8k-13k,1-3年,北京白龙马云行科技有限公司,台南路73号福兴国际中心1501单元,厦门
前端开发工程师,13k-20k,3-5年,深圳市汇合发展有限公司,科学科学园,深圳
前端开发工程师,14k-20k,3-5年,上海聚杰网络科技有限公司,西溪路527号钱江浙商创投中心507-509,杭州
前端开发工程师,15k-20k,3-5年,深圳市租享生活科技有限公司,粤海街道科技南八路2号豪威科技大厦1901,深圳
web前端开发工程师【自研】,13k-16k,3-5年,深圳聿旌科技有限公司,兴华一路与海秀路交界处19号前海HOP国际2301,深圳
前端开发工程师,15k-30k,3-5年,天翼云科技有限公司,广报中心南塔19楼,广州
前端开发工程师,8k-12k,3-5年,上海雅捷信息技术股份有限公司,南昌市高新技术产业开发区昌东大道7333号,南昌
前端开发工程师,15k-20k,3-5年,上海嵩恒网络科技股份有限公司,银冬路491号1号楼6楼,上海
前端开发工程师,10k-14k,3-5年,广州南天电脑系统有限公司,广州市天河区平云路平云广场A塔,广州
前端开发工程师,15k-25k,1-3年,上海亘岩网络科技有限公司,联航路1188弄浦江智谷33号楼,上海
前端工程师,10k-18k,1-3年,深圳异盾科技有限公司,余松西路149号2-1大成仓国际1栋1701,重庆
前端开发工程师,20k-35k,3-5年,网易（杭州）网络有限公司,网商路599号,杭州
前端开发工程师,15k-30k,3-5年,软视视频软件（杭州）有限公司,创新大道2800号创新产业园二期J2栋14楼,合肥
前端开发工程师,15k-20k,3-5年,上扬软件（上海）有限公司,光谷创业街9栋A,武汉
前端工程师,20k-28k,3-5年,北京快看世界信息技术有限公司,安贞门中海国际中心,北京
前端开发工程师,15k-20k,3-5年,西安人瑞网络科技有限公司,希音,广州
前端开发工程师,18k-20k,3-5年,深圳市微筑科技有限公司,北京市朝阳区光华路4号东方梅地亚c座606室,北京
前端,25k-35k,3-5年,特赞（上海）信息科技有限公司,天潼路328号星荟中心WeWork四楼,上海
前端工程师,20k-30k,3-5年,特赞（上海）信息科技有限公司,天潼路328号星荟中心WeWork四楼,上海
前端开发工程师,20k-30k,1-3年,特赞（上海）信息科技有限公司,天潼路328号星荟中心WeWork四楼,上海
前端研发工程师,15k-25k,3-5年,杭州绝地科技股份有限公司,欧美金融城英国中心T2写字楼38楼,杭州
前端开发工程师,14k-17k,3-5年,浙江之科云启科技有限公司,之江实验,杭州
前端研发工程师,25k-33k,不限,兴业普惠科技（福建）有限公司,兴业银行大厦西五楼,福州
前端实习生,4k-6k,在校/应届,江苏博云科技股份有限公司,北太平庄路18号城建大厦A座506,北京
前端开发工程师,8k-10k,1-3年,上海劢联企业管理咨询有限公司,高新开发区尖山路39号,长沙
高级前端开发工程师,15k-30k,3-5年,北京一览科技有限公司,来广营诚盈中心2号楼520单元,北京
前端开发工程师,18k-19k,3-5年,上海微创软件股份有限公司,北京市朝阳区红军营东路6号龙湖蓝海引擎产业园,北京
前端工程师,20k-40k,不限,贝式计算（天津）信息技术有限公司,天元港中心,北京
前端开发工程师,16k-25k,5-10年,北京新意互动数字技术有限公司,龙域中街龙域中心A座1002-1004,北京
前端开发工程师,15k-30k,5-10年,深圳凡泰极客科技有限责任公司,翠林大厦,深圳
前端开发工程师,15k-30k,5-10年,深圳凡泰极客科技有限责任公司,花都区,广州
前端开发工程师,15k-30k,5-10年,深圳凡泰极客科技有限责任公司,月坛北街25号47栋2层,北京
前端开发工程师,15k-30k,5-10年,深圳凡泰极客科技有限责任公司,武侯区,成都
前端开发工程师,20k-35k,1-3年,北京搜狐新媒体信息技术有限公司,搜狐媒体大厦,北京
前端开发工程师,16k-31k,3-5年,北京普世通达文化传媒有限公司,朝阳区十里河,北京
高级/资深前端开发工程师,25k-35k,3-5年,探探科技（北京）有限公司,光华路SOHO2D座6F,北京
前端开发工程师,15k-18k,3-5年,北京联龙博通电子商务技术有限公司,惠通时代广场,北京
前端开发工程师,12k-18k,3-5年,杭州博彦信息技术有限公司,恒锋一区,广州
前端开发工程师,20k-35k,5-10年,好喔科技（北京）有限公司,创业路8号群英科技园2号楼(清河站地铁站入口步行420米)联想(上地东路),北京
前端开发工程师,10k-15k,3-5年,广东联通通信建设有限公司,云来斯堡写字楼15楼,广州
前端开发工程师,20k-35k,不限,北京柏睿数据技术股份有限公司,武汉光谷保利国际中心,武汉
前端开发工程师,10k-18k,1-3年,北京柏睿数据技术股份有限公司,望京东园七区保利国际广场T1,北京
前端开发工程师,12k-18k,3-5年,北京博宇通达科技有限公司,高速大厦,北京
前端开发工程师,12k-16k,1-3年,北京鸿链科技有限公司,临空经济核心区天柱东路17号远洋盈创健康产业园8号楼202,北京
前端工程师,14k-18k,5-10年,广州华工弈高科技有限公司,潭村附近,广州
前端开发工程师,15k-25k,1-3年,深圳市爱思软件技术有限公司,创业路1777号海信南方大厦3103,深圳
中高级前端开发工程师,15k-25k,5-10年,柏美迪康环境科技（上海）股份有限公司,美年中心,成都
前程无忧-高级前端,20k-32k,5-10年,前锦网络信息技术（上海）有限公司北京分公司,江耀路晶耀前滩T6幢,上海
前端工程师,20k-25k,5-10年,中电金信软件有限公司,世界贸易中心17楼,成都
前端开发工程师,12k-18k,1-3年,北京联龙博通电子商务技术有限公司,信诚路567号，高新产业大楼B座,杭州
前端工程师,14k-17k,5-10年,广州华工弈高科技有限公司,潭村附近,广州
前端开发工程师,15k-22k,5-10年,上海意鹰信息技术有限公司,虹漕路461号软件大厦19楼,上海
前端工程师,15k-20k,5-10年,福寿康（上海）医疗养老服务有限公司,水电路1388号9楼,上海
前端开发工程师,15k-25k,3-5年,上海展盟网络科技有限公司,盛夏路666号上投盛银大厦E栋4楼,上海
前端开发工程师,15k-18k,3-5年,广州哇嘎文化传媒有限公司,东圃二马路盈科智谷10栋202,广州
前端开发工程师,10k-16k,3-5年,上海微创软件股份有限公司,武汉市汉阳区华中中交城D2栋,武汉
前端开发工程师,12k-21k,3-5年,上海尚简商务咨询中心,国际金融科技城,深圳
前端开发工程师,13k-25k,1-3年,兴业数字金融服务（上海）股份有限公司,世纪城路936号烟草兴业大厦,成都
前端开发高级工程师,15k-30k,3-5年,招银网络科技（深圳）有限公司,信诚路567号高新产业大楼B座,杭州
企业IT工程师-Web前端开发方向（腾音）,13k-20k,3-5年,腾讯音乐娱乐（深圳）有限公司,科兴科学园D3,深圳
前端开发工程师,10k-20k,3-5年,盟浪可持续数字科技（深圳）有限责任公司,北京市朝阳区光华路甲8号和乔大厦C座1206,北京
前端开发工程师,18k-35k,1-3年,北京外企德科人力资源服务上海有限公司,华为坂田,深圳
前端开发工程师,15k-20k,3-5年,北京数语科技有限公司,新华保险,深圳
前端开发工程师,14k-20k,1-3年,上海坤亿信息技术有限公司,浦电路399号,上海
前端开发工程师,15k-30k,3-5年,中企动力科技股份有限公司,经济技术开发区地盛西路一号数码庄园B1座,北京
前端工程师,11k-17k,3-5年,北京罗迅科技有限公司,鲁商国奥城,济南
前端开发工程师,20k-40k,3-5年,雄岸區塊鏈集團有限公司,华润置地D座,深圳
前端开发工程师,7k-12k,1-3年,广州市景心科技股份有限公司,天府路307号3楼（华景新城BRT附近）,广州
前端开发工程师,15k-18k,3-5年,广州哇嘎文化传媒有限公司,黄埔大道东保利鱼珠港S4栋3楼,广州
前端开发工程师,13k-17k,3-5年,北京联龙博通电子商务技术有限公司,科兴科学园,深圳
前端开发工程师,11k-16k,3-5年,上海微创软件股份有限公司,华中中交城,武汉
前端工程师,10k-20k,3-5年,北京健康在线网络技术有限公司,德胜门外大街甲10号中轻大厦5层/8层,北京
前端开发工程师,12k-18k,3-5年,上海裕宁信息科技有限公司,长阳创谷,上海
前端开发工程师,20k-25k,5-10年,中移互联网有限公司,秦淮区中山南路,南京
前端开发工程师,25k-35k,5-10年,卓越纵横（深圳）科技有限公司,中国华润大厦,深圳
前端开发工程师,35k-65k,5-10年,维沃移动通信有限公司,杭州市余杭区奥克斯·创智一号B1栋vivo智能手机公司,杭州
前端开发工程师,35k-65k,5-10年,维沃移动通信有限公司,杭州市余杭区奥克斯·创智一号B1栋vivo智能手机公司,杭州
前端开发工程师,15k-21k,3-5年,深圳市脉山龙信息技术股份有限公司,荣超商务中心,深圳
前端开发工程师,15k-25k,3-5年,美的集团股份有限公司,高新区天府四街158号OCG大厦B座16楼,成都
前端开发工程师,11k-15k,5-10年,深圳市博悦科创科技有限公司,国采中心武汉东湖新技术开发区国采中心T8栋,武汉
前端开发工程师,12k-18k,3-5年,杭州博彦信息技术有限公司,南京市雨花区软件大道170-1号天溯科技园5栋,南京
前端开发工程师,15k-30k,3-5年,北京传智播客教育科技有限公司,建材城西路金燕龙办公楼,北京
前端开发工程师,20k-30k,1-3年,上海一谈网络科技有限公司,漕河泾二期,上海
前端开发工程师,15k-19k,3-5年,深圳市同和信息技术有限公司,中电长城,深圳
前端开发工程师,10k-13k,1-3年,杭州数正云悦科技合伙企业（有限合伙）,省机电,杭州
前端开发工程师,10k-20k,3-5年,上扬软件（上海）有限公司,徽商大厦,南京
前端开发工程师,12k-20k,3-5年,亿磐系统（深圳）有限公司,苏州亿磐系统科技(苏州)有限公司12栋,苏州
前端开发工程师,10k-19k,3-5年,亿磐系统（深圳）有限公司,苏州市苏州工业园区星湖街328号创意产业园内12号楼 邮编215123,苏州
前端工程师,20k-40k,5-10年,小船出海教育科技（北京）有限公司,开拓路1号汇苑开拓大厦A座1层,北京
前端开发工程师,12k-15k,1-3年,浙江自贸区九拾信息技术服务有限公司,财富金融中心2幢1501室,杭州
前端开发工程师,16k-25k,3-5年,西藏保利爱家房地产经纪有限公司,琶洲保利国际广场北塔12楼,广州
前端开发工程师,15k-30k,3-5年,卓望数码技术（深圳）有限公司广州分公司,华星时代广场,杭州
前端开发工程师,15k-25k,3-5年,云上会展有限公司,东方海外大厦8楼,上海
前端开发工程师,12k-14k,3-5年,深圳市德科信息技术有限公司,云升,广州
前端开发工程师,12k-18k,5-10年,深圳楚星软件有限公司,武汉光谷中心城,武汉
前端开发工程师,13k-22k,3-5年,证通股份有限公司,望江西路900号中安创谷一期A4楼317室,合肥
前端开发工程师,15k-18k,3-5年,北京联龙博通电子商务技术有限公司,惠通时代111,北京
前端开发工程师,18k-26k,3-5年,海南凤凰木科技有限公司深圳分公司,阳光高尔夫大厦,深圳
前端开发工程师,13k-22k,3-5年,上海意鹰信息技术有限公司,虹漕路461号56幢漕河泾软件大厦19楼,上海
前端开发工程师,12k-20k,5-10年,深圳极市科技有限公司,经控集团大厦2-3楼,青岛
前端开发工程师,12k-20k,3-5年,上海淳南信息技术有限公司,上海市徐汇区石龙路581号漕河泾徳必易园403室,上海
前端工程师,12k-23k,5-10年,深圳楚星软件有限公司,武汉光谷中心城国采中心T8栋,武汉
前端开发工程师,15k-18k,3-5年,加绩（上海）科技服务有限公司,东方证券小南门,上海
前端开发工程师,10k-20k,1-3年,上海亿品贸易有限公司,灵石路697-3号巨丰商务楼,上海
前端开发工程师,9k-12k,3-5年,深圳市博悦科创科技有限公司,国采中心T8栋,武汉
前端开发工程师,13k-17k,3-5年,深圳市博悦科创科技有限公司,荣超大厦,深圳
前端开发工程师,13k-17k,3-5年,深圳市博悦科创科技有限公司,荣超大厦,深圳
前端开发工程师,15k-30k,3-5年,上海亘岩网络科技有限公司,联航路1188弄浦江智谷33号楼,上海
前端开发工程师,8k-13k,3-5年,深圳市博悦科创科技有限公司,国采中心,武汉
前端开发工程师,20k-35k,3-5年,叽里呱啦文化传播（上海）有限公司,宝地新华,上海
前端开发工程师,15k-30k,3-5年,拉卡拉信息科技（上海）有限公司,五星路727弄1-3,上海
前端开发工程师,14k-18k,3-5年,中移互联网有限公司,高唐路323号中国移动南方基地智汇中心,广州
前端开发工程师,13k-18k,1-3年,中移互联网有限公司,广东省广州市天河区高唐路323号中国移动南方基地智汇中心,广州
前端开发工程师,12k-17k,5-10年,北京同创永益科技发展有限公司,光谷软件园4期E3栋501,武汉
前端开发工程师,15k-16k,3-5年,加绩（上海）科技服务有限公司,中山南路东方,上海
前端开发工程师,14k-20k,3-5年,北京开科唯识技术股份有限公司,上海市浦东新区金沪路55号通华科技大厦,上海
前端开发工程师,15k-25k,3-5年,杭州安恒信息技术股份有限公司,西兴街道联慧街188号安恒大厦,杭州
前端开发工程师,15k-25k,3-5年,杭州安恒信息技术股份有限公司,西兴街道联慧街188号安恒大厦,杭州
前端开发工程师,9k-14k,3-5年,广东德生科技股份有限公司,天河区软件路15号2层,广州
前端开发工程师,7k-12k,1-3年,广东德生科技股份有限公司,天河区软件路15号2层,广州
前端开发工程师,14k-15k,5-10年,上海微创软件股份有限公司,华中中交城,武汉
前端开发工程师,15k-30k,3-5年,亚信科技（中国）有限公司,高朋大道3号东方希望A座12楼,成都
前端开发工程师,8k-10k,3-5年,上海微创软件股份有限公司,达美中心,长沙
前端开发工程师,15k-20k,5-10年,苏州叠纸网络科技股份有限公司,竹园路209号中国苏州创业园(珠江路),苏州
前端开发工程师,8k-10k,1-3年,上海微创软件股份有限公司,长沙芯,长沙
前端研发工程师,25k-45k,3-5年,北京猿力未来科技有限公司,广顺南大街8号院利星行中心A座F区5层,北京
前端开发工程师,20k-40k,3-5年,北京白龙马云行科技有限公司,望京国际研发园H座3层,北京
前端开发工程师,12k-18k,1-3年,深圳前海橙色魔方信息技术有限公司,科达投资大厦A座杭州滨江区信诚路555号科达投资大厦A座,杭州
前端开发工程师,10k-15k,5-10年,西坦科技（北京）有限公司,中山路508号东胜广场A座1405室,石家庄
前端开发工程师,13k-18k,3-5年,上海微创软件股份有限公司,杨浦区国正中心1号楼,上海
前端开发工程师,10k-18k,3-5年,佰聆数据股份有限公司,富广大厦17楼,合肥
前端开发工程师,14k-18k,3-5年,杭州数正云悦科技合伙企业（有限合伙）,杭州电信,杭州
前端开发工程师,20k-40k,3-5年,上海泛微网络科技股份有限公司,联航路1188弄浦江智谷33号楼,上海
前端开发工程师,13k-25k,1-3年,西安人瑞网络科技有限公司,天安云谷4,深圳
前端开发工程师,18k-21k,3-5年,深圳市脉山龙信息技术股份有限公司,福华一路123号(购物公园地铁站H口步行180米)中国人寿大厦,深圳
前端工程师,12k-18k,3-5年,广东胜通和科技服务有限公司,平云广场,广州
前端工程师,12k-18k,3-5年,广东胜通和科技服务有限公司,平云广场,广州
前端开发工程师,8k-13k,1-3年,泰豪软件股份有限公司,高新开发区高新大道590号泰豪信息大厦,南昌
前端开发工程师,10k-20k,3-5年,福建福诺移动通信技术有限公司,建省福州市软件大道89号A区27号楼,福州
前端开发工程师,20k-30k,3-5年,泰尔重工股份有限公司,漕河泾开发区松江高科技园莘砖公路518号23栋,上海
前端开发工程师,15k-25k,5-10年,中征（北京）征信有限责任公司,繁昌路298号,上海
前端开发工程师,10k-13k,1-3年,广州市数商云网络科技有限公司,新港东路1068号中洲中心北塔6楼,广州
前端工程师,20k-30k,1-3年,北京易点淘网络技术有限公司,西小口41号,北京
前端开发工程师,15k-25k,3-5年,连连银通电子支付有限公司,越达巷79号A楼11F,杭州
前端开发工程师,20k-30k,3-5年,北京金山办公软件股份有限公司,西二旗小米科技园D栋,北京
前端开发工程师,15k-25k,1-3年,深圳华强电子网集团股份有限公司,泰然大厦B座12楼,深圳
前端开发工程师,15k-25k,3-5年,深圳市拓保软件有限公司,科兴,深圳
